{
  "$schema": "http://json-schema.org/draft-07/schema#",
  "$id": "https://raw.githubusercontent.com/pablobernabeu/pilotr/main/spec/design.schema.json",
  "title": "pilotr design specification",
  "description": "Version 0.4. A specification with no spec_version field is a 0.2 specification. The schema states which fields each object may hold and their types, ranges and allowed values. It also states which parameters each response family requires and refuses. The R and Python implementations enforce the same rules through validate_spec() in strict mode, its default, and add the rules that relate one value to another or to the implementation. Every coefficient and random-slope key names a contrast column or a predictor, a contrast has one value per level and thresholds increase. A uniform predictor's min lies below its max, per_subject does not exceed the number of items, and a unit named by a factor, a predictor, a grouping factor or random.item exists. A correlation key names two terms of its group and gives each pair once. A specification using a 0.3 feature declares 0.3 or later and one using a 0.4 feature 0.4 or later. None declares a version newer than the implementation. Names do not collide (see Names in SPEC.md). Below version 0.4, no two factors are between the same unit, and from 0.4 a within factor lists every unit of the design (see Factors in SPEC.md). A counterbalanced factor needs an item unit and no per_subject (see Counterbalanced lists in SPEC.md).",
  "type": "object",
  "required": ["name", "seed", "units", "fixed", "response"],
  "additionalProperties": false,
  "properties": {
    "spec_version": {
      "type": "string",
      "pattern": "^[0-9]+\\.[0-9]+$",
      "description": "The specification version this design is written to. Absent means 0.2. Required to be \"0.3\" or later by any design using a 0.3 feature, and \"0.4\" or later by one with several between factors on one unit, which 0.4 allocates jointly, or with a factor that sets counterbalance. An earlier implementation reads such a design differently and generates different data without reporting a problem. pilotr writes the lowest version a design needs, never below 0.3, so that the releases reading 0.3 read it unless it uses a 0.4 feature."
    },
    "name": { "type": "string" },
    "seed": {
      "type": "integer",
      "minimum": -9007199254740991,
      "maximum": 9007199254740991,
      "description": "Master seed, within plus or minus (2^53 - 1): R reads a JSON number as a double, which holds every integer in that range exactly and not every one beyond it, while Python reads any integer exactly, so a larger seed would be two different numbers in the two implementations."
    },
    "units": {
      "type": "object",
      "properties": {
        "subject": { "$ref": "#/$defs/unit" },
        "item": { "$ref": "#/$defs/item_unit" }
      },
      "required": ["subject"],
      "additionalProperties": false
    },
    "factors": {
      "type": "array",
      "items": {
        "type": "object",
        "required": ["name", "levels", "contrasts"],
        "oneOf": [{ "required": ["vary_within"] }, { "required": ["between"] }],
        "properties": {
          "name": { "type": "string", "pattern": "\\S" },
          "levels": { "type": "array", "items": { "type": "string" }, "minItems": 2, "uniqueItems": true },
          "contrasts": {
            "type": "object",
            "minProperties": 1,
            "additionalProperties": { "type": "array", "items": { "type": "number" } },
            "description": "One numeric value per level, so each array's length equals the length of `levels`."
          },
          "vary_within": {
            "anyOf": [
              { "type": "array", "items": { "type": "string", "enum": ["subject", "item"] }, "minItems": 1 },
              { "type": "string", "enum": ["subject", "item"] }
            ],
            "description": "The units the factor varies within. pilotr crosses a within factor with every unit of the design, so a list that leaves a unit out draws a warning, and from 0.4 a refusal. A single unit name is read as a one-element array, the form pilotr's spec_json() wrote before 0.3."
          },
          "between": { "type": "string", "enum": ["subject", "item"] },
          "counterbalance": {
            "type": "boolean",
            "description": "New in 0.4. true on a within factor shows each subject each item at one level, rotated over subjects and items as in a Latin square: subject s meets item t at combination ((s - 1) + (t - 1)) mod C of the counterbalanced factors' levels, the first-listed factor varying slowest. Only the other within factors expand rows. It needs an item unit and is refused with per_subject, and false means the same as leaving it out. Earlier versions do not know the field, so a design that sets it declares 0.4 or later."
          }
        },
        "additionalProperties": false,
        "if": { "properties": { "counterbalance": { "const": true } }, "required": ["counterbalance"] },
        "then": { "required": ["vary_within"] }
      }
    },
    "predictors": {
      "type": "array",
      "items": {
        "type": "object",
        "required": ["name", "varies_by"],
        "properties": {
          "name": { "type": "string", "pattern": "\\S" },
          "varies_by": {
            "type": "string",
            "enum": ["subject", "item", "observation"],
            "description": "\"observation\" (new in 0.3) draws one value per row, for a predictor that varies trial by trial. A 0.2 implementation reads any value other than \"subject\" as item-level, which is why \"observation\" needs 0.3."
          },
          "mean": { "type": "number" },
          "sd": { "type": "number", "minimum": 0 },
          "dist": {
            "type": "string",
            "enum": ["normal", "uniform"],
            "description": "New in 0.3. \"uniform\" uses min and max, and a uniform predictor takes no mean or sd, as a normal one takes no min or max. A uniform draw consumes exactly as much of the random stream as a normal one, so switching between them does not move the stream."
          },
          "min": { "type": "number" },
          "max": { "type": "number" },
          "reliability": {
            "type": "number",
            "exclusiveMinimum": 0,
            "maximum": 1,
            "description": "New in 0.3. The latent value drives the linear predictor and any random slope keyed on the predictor, while the contaminated observed value appears in the data. The observed variable keeps the latent one's variance and correlates sqrt(reliability) with it. Absent or 1 draws nothing extra, so the stream is unchanged."
          }
        },
        "additionalProperties": false,
        "if": { "properties": { "dist": { "const": "uniform" } }, "required": ["dist"] },
        "then": { "required": ["min", "max"], "properties": { "mean": false, "sd": false } },
        "else": { "properties": { "min": false, "max": false } }
      }
    },
    "fixed": {
      "type": "object",
      "required": ["intercept", "coefficients"],
      "properties": {
        "intercept": { "type": "number" },
        "coefficients": {
          "type": "object",
          "additionalProperties": { "type": "number" },
          "description": "Keys are contrast columns, predictors, or an \"a:b\" interaction between them. A key naming no such column contributes zero, which silently removes the effect, so validate_spec() refuses one."
        }
      },
      "additionalProperties": false
    },
    "random": {
      "type": "object",
      "properties": {
        "subject": { "$ref": "#/$defs/unit_ranef" },
        "item": { "$ref": "#/$defs/unit_ranef" }
      },
      "propertyNames": { "pattern": "\\S" },
      "additionalProperties": { "$ref": "#/$defs/group_ranef" }
    },
    "response": {
      "type": "object",
      "required": ["family", "name"],
      "properties": {
        "family": {
          "type": "string",
          "enum": ["gaussian", "lognormal", "shifted_lognormal", "exgaussian", "bernoulli",
                   "poisson", "ordinal", "beta"]
        },
        "name": { "type": "string", "minLength": 1, "pattern": "\\S" },
        "sigma": { "type": "number", "exclusiveMinimum": 0 },
        "shift": { "type": "number" },
        "beta": {
          "type": "number",
          "exclusiveMinimum": 0,
          "description": "The exponential component's mean, for the exgaussian family (new in 0.3). Matches brms's exgaussian(mu, sigma, beta), in which mu is the mean of the response."
        },
        "phi": { "type": "number", "exclusiveMinimum": 0 },
        "thresholds": {
          "anyOf": [
            { "type": "array", "items": { "type": "number" }, "minItems": 1 },
            { "type": "number" }
          ],
          "description": "K-1 strictly increasing cut-points, for the ordinal family. A single cut-point written as a bare number is read as a one-element array, the form pilotr's spec_json() wrote before 0.3."
        },
        "round": {
          "type": "integer",
          "minimum": 0,
          "description": "Decimal rounding of the response. Only the families whose outcome is continuous take it, since the others are integers already. A beta response needs at least 1, because every proportion rounded to a whole number is 0 or 1."
        }
      },
      "additionalProperties": false,
      "$comment": "One block per family: the parameters it requires and the fields it refuses, as in FAMILY_PARAMS and ROUNDING_FAMILIES of the Python validator (python/pilotr/validate.py) and .family_params and .rounding_families of the R one (r/pilotr/R/validate.R). python/tests/test_schema.py and r/pilotr/tests/testthat/test-contract.R check that these blocks agree with each validator's tables.",
      "allOf": [
        {
          "if": { "properties": { "family": { "const": "gaussian" } }, "required": ["family"] },
          "then": {
            "required": ["sigma"],
            "properties": { "shift": false, "beta": false, "phi": false, "thresholds": false }
          }
        },
        {
          "if": { "properties": { "family": { "const": "lognormal" } }, "required": ["family"] },
          "then": {
            "required": ["sigma"],
            "properties": { "shift": false, "beta": false, "phi": false, "thresholds": false }
          }
        },
        {
          "if": { "properties": { "family": { "const": "shifted_lognormal" } }, "required": ["family"] },
          "then": {
            "required": ["sigma", "shift"],
            "properties": { "beta": false, "phi": false, "thresholds": false }
          }
        },
        {
          "if": { "properties": { "family": { "const": "exgaussian" } }, "required": ["family"] },
          "then": {
            "required": ["sigma", "beta"],
            "properties": { "shift": false, "phi": false, "thresholds": false }
          }
        },
        {
          "if": { "properties": { "family": { "enum": ["bernoulli", "poisson"] } }, "required": ["family"] },
          "then": {
            "properties": { "sigma": false, "shift": false, "beta": false, "phi": false,
                            "thresholds": false, "round": false }
          }
        },
        {
          "if": { "properties": { "family": { "const": "ordinal" } }, "required": ["family"] },
          "then": {
            "required": ["thresholds"],
            "properties": { "sigma": false, "shift": false, "beta": false, "phi": false, "round": false }
          }
        },
        {
          "if": { "properties": { "family": { "const": "beta" } }, "required": ["family"] },
          "then": {
            "required": ["phi"],
            "properties": { "sigma": false, "shift": false, "beta": false, "thresholds": false,
                            "round": { "minimum": 1 } }
          }
        }
      ]
    }
  },
  "$defs": {
    "unit": {
      "type": "object",
      "required": ["n"],
      "properties": {
        "n": { "type": "integer", "minimum": 1 }
      },
      "additionalProperties": false
    },
    "item_unit": {
      "type": "object",
      "required": ["n"],
      "properties": {
        "n": { "type": "integer", "minimum": 1 },
        "per_subject": {
          "type": "integer",
          "minimum": 1,
          "description": "Partial crossing: each subject sees this many items, sampled at random. Belongs to units.item and cannot exceed units.item.n."
        }
      },
      "additionalProperties": false
    },
    "ranef": {
      "type": "object",
      "properties": {
        "intercept_sd": { "type": "number", "minimum": 0 },
        "slopes": {
          "type": "object",
          "additionalProperties": { "type": "number", "minimum": 0 },
          "description": "Keys follow the same rule as fixed coefficients, so an \"a:b\" interaction slope is allowed from 0.3. A 0.2 implementation draws such a slope and then discards it, which makes the analysis model richer than the process that generated the data."
        },
        "correlations": {
          "type": "object",
          "additionalProperties": { "type": "number", "minimum": -1, "maximum": 1 },
          "description": "Keyed \"a,b\" or \"a~b\", naming two different terms of this group's random effects: \"intercept\" or one of its slopes, in either order, so a pair of slopes is as valid as the intercept and a slope. Each pair is given once, in one order only. The resulting covariance has to be positive definite; one that is not is an error rather than something to clamp."
        },
        "correlated": {
          "type": "boolean",
          "description": "New in 0.3. Whether this group's random effects are correlated, defaulting to whether `correlations` is supplied. It decides whether the emitted lmer and brms formulas use a single or a double bar, so that the analysis model matches the generative process instead of always estimating a correlation the process may have fixed at zero. Setting it to false alongside `correlations` is contradictory and is refused."
        },
        "over": { "type": "string", "enum": ["subject", "item"] },
        "n": { "type": "integer", "minimum": 1 }
      },
      "required": ["intercept_sd"],
      "additionalProperties": false,
      "if": { "properties": { "correlated": { "const": false } }, "required": ["correlated"] },
      "then": { "properties": { "correlations": { "maxProperties": 0 } } }
    },
    "unit_ranef": {
      "description": "The random effects of the subject or item unit, which take no over or n.",
      "allOf": [{ "$ref": "#/$defs/ranef" }, { "properties": { "over": false, "n": false } }]
    },
    "group_ranef": {
      "description": "An additional grouping factor: the unit it groups (over) and its number of groups (n).",
      "allOf": [{ "$ref": "#/$defs/ranef" }, { "required": ["over", "n"] }]
    }
  }
}
