{
  "spec_version": "0.4",
  "name": "counterbalanced_three_conditions",
  "seed": 3301,
  "units": { "subject": { "n": 18 }, "item": { "n": 12 } },
  "factors": [
    { "name": "cond", "levels": ["a", "b", "c"],
      "contrasts": { "c1": [-0.5, 0.5, 0], "c2": [-0.5, 0, 0.5] },
      "vary_within": ["subject", "item"], "counterbalance": true },
    { "name": "task", "levels": ["read", "listen"], "contrasts": { "tk": [-0.5, 0.5] },
      "vary_within": ["subject", "item"] }
  ],
  "fixed": {
    "intercept": 5.0,
    "coefficients": { "c1": 0.3, "c2": 0.5, "tk": 0.2, "c1:tk": 0.1, "c2:tk": -0.15 }
  },
  "random": {
    "subject": { "intercept_sd": 0.8, "slopes": { "c1": 0.3, "c2": 0.25, "tk": 0.2 },
                 "correlations": { "intercept,c1": 0.2, "c1,c2": 0.3 } },
    "item": { "intercept_sd": 0.4, "slopes": { "c1": 0.15, "c2": 0.1 } }
  },
  "response": { "family": "gaussian", "name": "score", "sigma": 1.0 }
}
