{
  "spec_version": "0.3",
  "name": "within_cluster_randomised",
  "seed": 9067,
  "units": { "subject": { "n": 120 } },
  "factors": [
    {
      "name": "arm",
      "levels": ["s01_control", "s01_treatment", "s02_control", "s02_treatment",
                 "s03_control", "s03_treatment", "s04_control", "s04_treatment",
                 "s05_control", "s05_treatment", "s06_control", "s06_treatment",
                 "s07_control", "s07_treatment", "s08_control", "s08_treatment",
                 "s09_control", "s09_treatment", "s10_control", "s10_treatment",
                 "s11_control", "s11_treatment", "s12_control", "s12_treatment"],
      "contrasts": { "trt": [-0.5, 0.5, -0.5, 0.5, -0.5, 0.5, -0.5, 0.5, -0.5, 0.5, -0.5, 0.5,
                             -0.5, 0.5, -0.5, 0.5, -0.5, 0.5, -0.5, 0.5, -0.5, 0.5, -0.5, 0.5] },
      "between": "subject"
    }
  ],
  "fixed": { "intercept": 50.0, "coefficients": { "trt": 2.0 } },
  "random": {
    "site": { "over": "subject", "n": 12, "intercept_sd": 3.0, "slopes": { "trt": 1.0 } }
  },
  "response": { "family": "gaussian", "name": "score", "sigma": 10.0 }
}
