{
  "spec_version": "0.3",
  "name": "stress_v03_gaussian",
  "seed": 20260725,
  "units": { "subject": { "n": 24 }, "item": { "n": 16 } },
  "factors": [
    { "name": "condition", "levels": ["a", "b"], "contrasts": { "cond": [-0.5, 0.5] },
      "vary_within": ["subject", "item"] }
  ],
  "predictors": [
    { "name": "z_reading", "varies_by": "subject", "mean": 0, "sd": 1, "reliability": 0.8 },
    { "name": "z_freq", "varies_by": "item", "mean": 0, "sd": 1 },
    { "name": "ISI", "varies_by": "observation", "dist": "uniform", "min": 200, "max": 800 },
    { "name": "z_trial", "varies_by": "observation", "mean": 0, "sd": 1, "reliability": 0.5 }
  ],
  "fixed": {
    "intercept": 0.0,
    "coefficients": {
      "cond": 0.3,
      "z_reading": 0.2,
      "z_freq": -0.15,
      "ISI": 0.0005,
      "z_trial": 0.05,
      "cond:z_reading": 0.1
    }
  },
  "random": {
    "subject": {
      "intercept_sd": 0.4,
      "slopes": { "cond": 0.2, "z_freq": 0.15 },
      "correlations": {
        "intercept,cond": 0.2,
        "intercept,z_freq": 0.1,
        "cond,z_freq": 0.15
      }
    },
    "item": {
      "intercept_sd": 0.3,
      "slopes": { "cond": 0.2 },
      "correlated": false
    }
  },
  "response": { "family": "gaussian", "name": "score", "sigma": 1.0 }
}
