{
  "name": "extra_group_subject_site",
  "seed": 4417,
  "units": { "subject": { "n": 12 }, "item": { "n": 4 } },
  "factors": [
    {
      "name": "condition",
      "levels": ["a", "b"],
      "contrasts": { "cond": [-0.5, 0.5] },
      "vary_within": ["subject", "item"]
    }
  ],
  "fixed": { "intercept": 10.0, "coefficients": { "cond": 0.5 } },
  "random": {
    "subject_site": { "over": "subject", "n": 3, "intercept_sd": 2.0 }
  },
  "response": { "family": "gaussian", "name": "score", "sigma": 1.0 }
}
