{
  "spec_version": "0.3",
  "name": "two_list_counterbalanced",
  "seed": 2417,
  "units": { "subject": { "n": 24 }, "item": { "n": 18 } },
  "factors": [
    {
      "name": "list",
      "levels": ["list1", "list2"],
      "contrasts": { "l": [-1, 1] },
      "between": "subject"
    },
    {
      "name": "item_set",
      "levels": ["setA", "setB"],
      "contrasts": { "g": [-0.5, 0.5] },
      "between": "item"
    }
  ],
  "fixed": { "intercept": 6.0, "coefficients": { "l:g": 0.06 } },
  "random": {
    "subject": {
      "intercept_sd": 0.12,
      "slopes": { "l:g": 0.04 },
      "correlations": { "intercept,l:g": 0.2 }
    },
    "item": {
      "intercept_sd": 0.08,
      "slopes": { "l:g": 0.02 },
      "correlations": { "intercept,l:g": -0.1 }
    }
  },
  "response": { "family": "gaussian", "name": "logRT", "sigma": 0.3 }
}
