{
  "spec_version": "0.4",
  "name": "counterbalanced_two_conditions",
  "seed": 2417,
  "units": { "subject": { "n": 24 }, "item": { "n": 18 } },
  "factors": [
    {
      "name": "cond",
      "levels": ["related", "unrelated"],
      "contrasts": { "cond": [-0.5, 0.5] },
      "vary_within": ["subject", "item"],
      "counterbalance": true
    }
  ],
  "fixed": { "intercept": 6.0, "coefficients": { "cond": 0.06 } },
  "random": {
    "subject": {
      "intercept_sd": 0.12,
      "slopes": { "cond": 0.04 },
      "correlations": { "intercept,cond": 0.2 }
    },
    "item": {
      "intercept_sd": 0.08,
      "slopes": { "cond": 0.02 },
      "correlations": { "intercept,cond": -0.1 }
    }
  },
  "response": { "family": "gaussian", "name": "logRT", "sigma": 0.3 }
}
