{
  "spec_version": "0.4",
  "name": "three_by_two_joint",
  "seed": 2604,
  "units": { "subject": { "n": 12 }, "item": { "n": 8 } },
  "factors": [
    { "name": "dose", "levels": ["d0", "d1", "d2"],
      "contrasts": { "d1": [-0.5, 0.5, 0], "d2": [-0.5, 0, 0.5] }, "between": "subject" },
    { "name": "group", "levels": ["g1", "g2"], "contrasts": { "g": [-0.5, 0.5] },
      "between": "subject" },
    { "name": "cond", "levels": ["x", "y"], "contrasts": { "c": [-0.5, 0.5] },
      "vary_within": ["subject", "item"] },
    { "name": "freq", "levels": ["lo", "hi"], "contrasts": { "f": [-0.5, 0.5] },
      "between": "item" },
    { "name": "len", "levels": ["short", "long"], "contrasts": { "l": [-0.5, 0.5] },
      "between": "item" }
  ],
  "fixed": {
    "intercept": 5.0,
    "coefficients": { "d1": 0.4, "d2": 0.7, "g": 0.3, "d1:g": 0.2, "d2:g": -0.1, "c": 0.25,
                      "f": 0.15, "l": -0.2, "f:l": 0.1 }
  },
  "random": {
    "subject": { "intercept_sd": 0.8, "slopes": { "c": 0.3 },
                 "correlations": { "intercept,c": 0.2 } },
    "item": { "intercept_sd": 0.4, "slopes": { "c": 0.1 } }
  },
  "response": { "family": "gaussian", "name": "score", "sigma": 1.0 }
}
