{
  "name": "beta_proportion",
  "seed": 909,
  "units": { "subject": { "n": 200 } },
  "factors": [
    { "name": "group", "levels": ["control", "treatment"], "contrasts": { "grp": [-0.5, 0.5] },
      "between": "subject" }
  ],
  "fixed": { "intercept": 0.0, "coefficients": { "grp": 0.8 } },
  "random": {},
  "response": { "family": "beta", "name": "prop", "phi": 8, "round": 5 }
}
