{
  "spec_version": "0.3",
  "name": "stress_interaction_slopes",
  "seed": 31337,
  "units": { "subject": { "n": 32 }, "item": { "n": 20 } },
  "factors": [
    { "name": "condition", "levels": ["a", "b"], "contrasts": { "cond": [-0.5, 0.5] },
      "vary_within": ["subject", "item"] }
  ],
  "predictors": [
    { "name": "z_freq", "varies_by": "item", "mean": 0, "sd": 1 },
    { "name": "z_span", "varies_by": "subject", "mean": 0, "sd": 1 }
  ],
  "fixed": {
    "intercept": 0.0,
    "coefficients": {
      "cond": 0.3,
      "z_freq": -0.2,
      "z_span": 0.25,
      "cond:z_freq": 0.12,
      "cond:z_span": -0.1
    }
  },
  "random": {
    "subject": {
      "intercept_sd": 0.5,
      "slopes": { "cond": 0.3, "z_freq": 0.2, "cond:z_freq": 0.25 },
      "correlations": {
        "intercept,cond": 0.2,
        "intercept,z_freq": 0.2,
        "intercept,cond:z_freq": 0.2,
        "cond,z_freq": 0.2,
        "cond,cond:z_freq": 0.2,
        "z_freq,cond:z_freq": 0.2
      }
    },
    "item": {
      "intercept_sd": 0.4,
      "slopes": { "cond": 0.25, "z_span": 0.2, "cond:z_span": 0.15 },
      "correlations": {
        "intercept,cond": 0.2,
        "intercept,z_span": 0.2,
        "intercept,cond:z_span": 0.2,
        "cond,z_span": 0.2,
        "cond,cond:z_span": 0.2,
        "z_span,cond:z_span": 0.2
      }
    }
  },
  "response": { "family": "gaussian", "name": "score", "sigma": 1.0 }
}
